{
  "input_map": "lines.png",
  "map_description": "three simple lines",
  "fft_filtering": {
    "peak_height": 0.05,
    "smooth_histogram": true,
    "sigma": 0.5,
    "window_width": 5,
    "quality_threshold": 0.18,
    "angle_threshold": 0.5
  },
  "visualisation": {
    "Save path": "/home/tzkr/Experiments/ROSE/2021/testing",
    "Input map": true,
    "Binary map": true,
    "Frequency image": true,
    "Frequency image with dominant directions": true,
    "Frequency image with filter": true,
    "Filter": true,
    "Filtered frequency image": true,
    "Polar frequency image": true,
    "Polar frequency histogram": true,
    "Polar frequency image and histogram": true,
    "Reconstructed map": true,
    "Scored map": true,
    "Filtered map overlay": true,
    "Filtered map final": true,
    "Cell histogram": true,
    "Map with directions": true,
    "Map with long wall lines": true
  }
}